{
    "$schema": "http://json-schema.org/draft-07/schema#",
    "$id": "https://lightdash.com/schemas/release-safety/v2.json",
    "title": "Lightdash release-safety artifact",
    "description": "Machine-readable upgrade-safety signal attached to each Lightdash release. Every unknown value MUST be consumed as unsafe. The artifact shrinks as the runtime grows: once the runtime self-recovers a risk, that warning leaves this contract instead of becoming permanent signal baggage.",
    "type": "object",
    "additionalProperties": false,
    "required": [
        "schemaVersion",
        "version",
        "previousVersion",
        "releaseDate",
        "migrations",
        "compatibility",
        "api",
        "config",
        "upgrade",
        "declaredBreaks"
    ],
    "definitions": {
        "triState": {
            "description": "unknown means the check could not prove safety and MUST be treated as unsafe.",
            "oneOf": [
                { "type": "boolean" },
                { "type": "string", "const": "unknown" }
            ]
        },
        "apiSurface": {
            "type": "object",
            "additionalProperties": false,
            "required": [
                "checked",
                "breaking",
                "changes",
                "breakingCount",
                "advisories",
                "advisoryCount"
            ],
            "properties": {
                "checked": { "type": "boolean" },
                "breaking": { "$ref": "#/definitions/triState" },
                "changes": {
                    "type": "array",
                    "items": { "type": "string" },
                    "description": "Endpoint-specific REST or tool-specific MCP breaking-change details."
                },
                "breakingCount": { "type": "integer", "minimum": 0 },
                "advisories": {
                    "type": "array",
                    "items": { "type": "string" }
                },
                "advisoryCount": { "type": "integer", "minimum": 0 }
            }
        },
        "configChange": {
            "oneOf": [
                {
                    "type": "object",
                    "additionalProperties": false,
                    "required": ["type", "name", "previousDefault"],
                    "properties": {
                        "type": { "const": "removed" },
                        "name": { "type": "string" },
                        "previousDefault": { "type": ["string", "null"] }
                    }
                },
                {
                    "type": "object",
                    "additionalProperties": false,
                    "required": ["type", "name", "previousName", "defaultValue"],
                    "properties": {
                        "type": { "const": "renamed" },
                        "name": { "type": "string" },
                        "previousName": { "type": "string" },
                        "defaultValue": { "type": ["string", "null"] }
                    }
                },
                {
                    "type": "object",
                    "additionalProperties": false,
                    "required": ["type", "name", "previousDefault", "defaultValue"],
                    "properties": {
                        "type": { "const": "defaultChanged" },
                        "name": { "type": "string" },
                        "previousDefault": { "type": ["string", "null"] },
                        "defaultValue": { "type": ["string", "null"] }
                    }
                }
            ]
        },
        "impact": {
            "type": "object",
            "additionalProperties": false,
            "required": ["kind", "covers"],
            "properties": {
                "kind": { "const": "no-external-callers" },
                "featureFlag": { "type": "string", "pattern": "\\S" },
                "firstPartyOnly": { "$ref": "#/definitions/substantiveReason" },
                "covers": {
                    "type": "object",
                    "additionalProperties": false,
                    "required": ["rest", "mcp"],
                    "properties": {
                        "rest": {
                            "type": "array",
                            "uniqueItems": true,
                            "items": {
                                "type": "string",
                                "pattern": "^[A-Z]+ /\\S*(?![\\s\\S])"
                            }
                        },
                        "mcp": {
                            "type": "array",
                            "uniqueItems": true,
                            "items": {
                                "type": "string",
                                "pattern": "^[^`\\s]+(?![\\s\\S])"
                            }
                        }
                    },
                    "anyOf": [
                        {
                            "properties": {
                                "rest": { "type": "array", "minItems": 1 }
                            }
                        },
                        {
                            "properties": {
                                "mcp": { "type": "array", "minItems": 1 }
                            }
                        }
                    ]
                }
            },
            "oneOf": [
                {
                    "properties": { "featureFlag": {} },
                    "required": ["featureFlag"]
                },
                {
                    "properties": { "firstPartyOnly": {} },
                    "required": ["firstPartyOnly"]
                }
            ]
        },
        "substantiveReason": {
            "type": "string",
            "pattern": "^\\s*(?=\\S)(?=(?:\\S|\\s+(?=\\S)){24,}\\s*$)(?=\\S+(?:\\s+\\S+)+\\s*$)",
            "not": {
                "pattern": "^\\s*<[oO][pP][eE][rR][aA][tT][oO][rR]-[fF][aA][cC][iI][nN][gG]\\s+[rR][eE][aA][sS][oO][nN]>\\s*$"
            }
        }
    },
    "properties": {
        "schemaVersion": { "type": "string", "const": "2" },
        "version": {
            "type": "string",
            "description": "Release version. Development builds commit a sentinel (version: development, releaseDate: epoch 0); the release pipeline overwrites with real values — all-unknown fields make the sentinel fail-safe under the unknown-is-unsafe contract."
        },
        "previousVersion": { "type": ["string", "null"] },
        "releaseDate": {
            "type": "string",
            "format": "date-time",
            "description": "Release timestamp. Epoch 0 is the committed development sentinel, not a bug — see the version field's sentinel note; the release pipeline overwrites it."
        },
        "migrations": {
            "type": "object",
            "additionalProperties": false,
            "required": ["present", "count", "coreCount", "eeCount", "files"],
            "properties": {
                "present": { "$ref": "#/definitions/triState" },
                "count": { "type": "integer", "minimum": 0 },
                "coreCount": { "type": "integer", "minimum": 0 },
                "eeCount": { "type": "integer", "minimum": 0 },
                "files": {
                    "type": "array",
                    "items": {
                        "type": "object",
                        "additionalProperties": false,
                        "required": ["name", "edition", "tables", "heaviness"],
                        "properties": {
                            "name": { "type": "string" },
                            "edition": { "type": "string", "enum": ["core", "ee"] },
                            "tables": { "type": "array", "items": { "type": "string" } },
                            "heaviness": {
                                "type": "object",
                                "additionalProperties": false,
                                "required": ["locksTable", "rewritesTable", "scansTable"],
                                "properties": {
                                    "locksTable": { "$ref": "#/definitions/triState" },
                                    "rewritesTable": { "$ref": "#/definitions/triState" },
                                    "scansTable": { "$ref": "#/definitions/triState" }
                                }
                            }
                        }
                    }
                }
            }
        },
        "compatibility": {
            "type": "object",
            "additionalProperties": false,
            "required": ["rollingUpdateSafe", "recommendedStrategy"],
            "properties": {
                "rollingUpdateSafe": { "$ref": "#/definitions/triState" },
                "recommendedStrategy": {
                    "type": "string",
                    "enum": ["Recreate", "RollingUpdate"],
                    "description": "Derived from rollingUpdateSafe. Consumers MUST gate on rollingUpdateSafe, not this convenience rendering."
                }
            }
        },
        "api": {
            "type": "object",
            "additionalProperties": false,
            "required": ["rest", "mcp"],
            "properties": {
                "rest": { "$ref": "#/definitions/apiSurface" },
                "mcp": { "$ref": "#/definitions/apiSurface" }
            }
        },
        "config": {
            "type": "object",
            "additionalProperties": false,
            "required": ["checked", "breaking", "changes"],
            "properties": {
                "checked": { "type": "boolean" },
                "breaking": { "$ref": "#/definitions/triState" },
                "changes": { "type": "array", "items": { "$ref": "#/definitions/configChange" } }
            }
        },
        "upgrade": {
            "type": "object",
            "additionalProperties": false,
            "required": ["minPreviousVersion", "requiredStops"],
            "properties": {
                "minPreviousVersion": { "type": ["string", "null"] },
                "requiredStops": { "type": "array", "items": { "type": "string" } }
            }
        },
        "declaredBreaks": {
            "type": "array",
            "items": {
                "type": "object",
                "additionalProperties": false,
                "required": ["id", "reason", "requiredStop"],
                "properties": {
                    "id": { "type": "string", "minLength": 1 },
                    "reason": { "type": "string", "minLength": 1 },
                    "requiredStop": { "type": "boolean" },
                    "migration": { "type": "string" },
                    "releasedIn": { "type": "string", "minLength": 1 }
                }
            }
        },
        "declaredAdvisories": {
            "type": "array",
            "items": {
                "type": "object",
                "additionalProperties": false,
                "required": ["id", "reason", "requiredStop", "impact"],
                "properties": {
                    "id": { "type": "string", "pattern": "\\S" },
                    "reason": { "$ref": "#/definitions/substantiveReason" },
                    "requiredStop": { "const": false },
                    "impact": { "$ref": "#/definitions/impact" }
                }
            }
        }
    }
}
